{
  "edges": [
    {
      "actions": [
        "s3:*"
      ],
      "digest": "483668c4bde001b4",
      "effect": "Allow",
      "id": "aws:111122223333:us-east-1/aws_iam_policy.app_admin#stmt:FullDataAccess",
      "resolution": "resolved",
      "resource_patterns": [
        "arn:aws:s3:::acme-prod-app-data",
        "arn:aws:s3:::acme-prod-app-data/*"
      ],
      "sid": "FullDataAccess",
      "source": "aws:111122223333:us-east-1/aws_iam_policy.app_admin",
      "target": "aws:111122223333:us-east-1/aws_s3_bucket.data",
      "type": "grants",
      "unevaluated": []
    },
    {
      "actions": [
        "iam:*"
      ],
      "digest": "55c6c9e57c5c8181",
      "effect": "Allow",
      "id": "aws:111122223333:us-east-1/aws_iam_policy.app_admin#stmt:ManageAppRoles@aws_iam_role.app_admin",
      "resolution": "resolved",
      "resource_patterns": [
        "arn:aws:iam::111122223333:role/prod-*"
      ],
      "sid": "ManageAppRoles",
      "source": "aws:111122223333:us-east-1/aws_iam_policy.app_admin",
      "target": "aws:111122223333:us-east-1/aws_iam_role.app_admin",
      "type": "grants",
      "unevaluated": []
    },
    {
      "actions": [
        "iam:*"
      ],
      "digest": "f08974381dc18fec",
      "effect": "Allow",
      "id": "aws:111122223333:us-east-1/aws_iam_policy.app_admin#stmt:ManageAppRoles@aws_iam_role.deployer",
      "resolution": "resolved",
      "resource_patterns": [
        "arn:aws:iam::111122223333:role/prod-*"
      ],
      "sid": "ManageAppRoles",
      "source": "aws:111122223333:us-east-1/aws_iam_policy.app_admin",
      "target": "aws:111122223333:us-east-1/aws_iam_role.deployer",
      "type": "grants",
      "unevaluated": []
    },
    {
      "actions": [
        "iam:*"
      ],
      "digest": "1b445bb53151d149",
      "effect": "Allow",
      "id": "aws:111122223333:us-east-1/aws_iam_policy.app_admin#stmt:ManageAppRoles@module.app.aws_iam_role.this",
      "resolution": "resolved",
      "resource_patterns": [
        "arn:aws:iam::111122223333:role/prod-*"
      ],
      "sid": "ManageAppRoles",
      "source": "aws:111122223333:us-east-1/aws_iam_policy.app_admin",
      "target": "aws:111122223333:us-east-1/module.app.aws_iam_role.this",
      "type": "grants",
      "unevaluated": []
    },
    {
      "actions": [
        "kms:*"
      ],
      "digest": "3a8677eb073b7a12",
      "effect": "Allow",
      "id": "aws:111122223333:us-east-1/aws_iam_policy.app_admin#stmt:ManageKeys",
      "resolution": "resolved",
      "resource_patterns": [
        "*"
      ],
      "sid": "ManageKeys",
      "source": "aws:111122223333:us-east-1/aws_iam_policy.app_admin",
      "target": "aws:111122223333:us-east-1/wildcard.all",
      "type": "grants",
      "unevaluated": []
    },
    {
      "actions": [
        "kms:Decrypt",
        "kms:Encrypt",
        "kms:GenerateDataKey*"
      ],
      "digest": "6c423aca8ab7ff20",
      "effect": "Allow",
      "id": "aws:111122223333:us-east-1/aws_iam_policy.kms_use#stmt:UseDataKey",
      "resolution": "unresolved_at_plan",
      "resource_patterns": [],
      "sid": "UseDataKey",
      "source": "aws:111122223333:us-east-1/aws_iam_policy.kms_use",
      "target": "aws:111122223333:us-east-1/aws_kms_key.main",
      "type": "grants",
      "unevaluated": [
        "unresolved_policy_body"
      ]
    },
    {
      "actions": [
        "s3:PutObject"
      ],
      "digest": "59ca40e9b988bec9",
      "effect": "Allow",
      "id": "aws:111122223333:us-east-1/aws_iam_policy.kms_use#stmt:WriteAppData",
      "resolution": "resolved",
      "resource_patterns": [
        "arn:aws:s3:::acme-prod-app-data/*"
      ],
      "sid": "WriteAppData",
      "source": "aws:111122223333:us-east-1/aws_iam_policy.kms_use",
      "target": "aws:111122223333:us-east-1/aws_s3_bucket.data",
      "type": "grants",
      "unevaluated": []
    },
    {
      "actions": [],
      "digest": "ec0ac66eaea305f5",
      "effect": null,
      "id": "aws:111122223333:us-east-1/aws_iam_role.app_admin#attach:aws_iam_policy.app_admin",
      "resolution": "resolved",
      "resource_patterns": [],
      "sid": null,
      "source": "aws:111122223333:us-east-1/aws_iam_role.app_admin",
      "target": "aws:111122223333:us-east-1/aws_iam_policy.app_admin",
      "type": "attaches",
      "unevaluated": []
    },
    {
      "actions": [
        "sts:AssumeRole"
      ],
      "digest": "640f1116a4f20dc1",
      "effect": "Allow",
      "id": "aws:111122223333:us-east-1/aws_iam_role.app_admin#trust:aws:999988887777:us-east-1/aws_iam_role.mgmt_deploy",
      "resolution": "resolved",
      "resource_patterns": [],
      "sid": "ManagementDeploy",
      "source": "aws:999988887777:us-east-1/aws_iam_role.mgmt_deploy",
      "target": "aws:111122223333:us-east-1/aws_iam_role.app_admin",
      "type": "can_assume",
      "unevaluated": []
    },
    {
      "actions": [
        "sts:AssumeRole"
      ],
      "digest": "079da991e5ad02d1",
      "effect": "Allow",
      "id": "aws:111122223333:us-east-1/aws_iam_role.app_admin#trust:external.arn:aws:iam::555566667777:role/third-party-audit",
      "resolution": "resolved",
      "resource_patterns": [],
      "sid": "ThirdPartyAudit",
      "source": "aws:111122223333:us-east-1/external.arn:aws:iam::555566667777:role/third-party-audit",
      "target": "aws:111122223333:us-east-1/aws_iam_role.app_admin",
      "type": "can_assume",
      "unevaluated": [
        "condition"
      ]
    },
    {
      "actions": [],
      "digest": "75cc05b21a92732a",
      "effect": null,
      "id": "aws:111122223333:us-east-1/aws_iam_role.deployer#attach:aws_iam_role_policy.deployer",
      "resolution": "resolved",
      "resource_patterns": [],
      "sid": null,
      "source": "aws:111122223333:us-east-1/aws_iam_role.deployer",
      "target": "aws:111122223333:us-east-1/aws_iam_role_policy.deployer",
      "type": "attaches",
      "unevaluated": []
    },
    {
      "actions": [
        "sts:AssumeRole"
      ],
      "digest": "360f140bb8c9491d",
      "effect": "Allow",
      "id": "aws:111122223333:us-east-1/aws_iam_role.deployer#trust:aws:999988887777:us-east-1/aws_iam_role.mgmt_deploy",
      "resolution": "resolved",
      "resource_patterns": [],
      "sid": "ManagementDeploy",
      "source": "aws:999988887777:us-east-1/aws_iam_role.mgmt_deploy",
      "target": "aws:111122223333:us-east-1/aws_iam_role.deployer",
      "type": "can_assume",
      "unevaluated": []
    },
    {
      "actions": [
        "lambda:GetFunction",
        "lambda:UpdateFunctionCode",
        "lambda:UpdateFunctionConfiguration"
      ],
      "digest": "0bd194db2046fa6f",
      "effect": "Allow",
      "id": "aws:111122223333:us-east-1/aws_iam_role_policy.deployer#stmt:DeployFunctions",
      "resolution": "resolved",
      "resource_patterns": [
        "arn:aws:lambda:us-east-1:111122223333:function:app-*"
      ],
      "sid": "DeployFunctions",
      "source": "aws:111122223333:us-east-1/aws_iam_role_policy.deployer",
      "target": "aws:111122223333:us-east-1/external.arn:aws:lambda:us-east-1:111122223333:function:app-*",
      "type": "grants",
      "unevaluated": []
    },
    {
      "actions": [
        "iam:PassRole"
      ],
      "digest": "aaee3bec5343bcc2",
      "effect": "Allow",
      "id": "aws:111122223333:us-east-1/aws_iam_role_policy.deployer#stmt:PassAppRole",
      "resolution": "resolved",
      "resource_patterns": [
        "arn:aws:iam::111122223333:role/prod-app"
      ],
      "sid": "PassAppRole",
      "source": "aws:111122223333:us-east-1/aws_iam_role_policy.deployer",
      "target": "aws:111122223333:us-east-1/module.app.aws_iam_role.this",
      "type": "grants",
      "unevaluated": []
    },
    {
      "actions": [
        "s3:ListBucket"
      ],
      "digest": "e40fd76f8e02509b",
      "effect": "Allow",
      "id": "aws:111122223333:us-east-1/module.app.aws_iam_policy.data_read#stmt:ListAppData",
      "resolution": "resolved",
      "resource_patterns": [
        "arn:aws:s3:::acme-prod-app-data"
      ],
      "sid": "ListAppData",
      "source": "aws:111122223333:us-east-1/module.app.aws_iam_policy.data_read",
      "target": "aws:111122223333:us-east-1/aws_s3_bucket.data",
      "type": "grants",
      "unevaluated": []
    },
    {
      "actions": [
        "s3:*"
      ],
      "digest": "7a2875761059a8e9",
      "effect": "Allow",
      "id": "aws:111122223333:us-east-1/module.app.aws_iam_policy.data_read#stmt:ReadAppData",
      "resolution": "resolved",
      "resource_patterns": [
        "arn:aws:s3:::acme-prod-app-data/*"
      ],
      "sid": "ReadAppData",
      "source": "aws:111122223333:us-east-1/module.app.aws_iam_policy.data_read",
      "target": "aws:111122223333:us-east-1/aws_s3_bucket.data",
      "type": "grants",
      "unevaluated": []
    },
    {
      "actions": [],
      "digest": "9bc97726159181ee",
      "effect": null,
      "id": "aws:111122223333:us-east-1/module.app.aws_iam_role.this#attach:aws_iam_policy.kms_use",
      "resolution": "resolved",
      "resource_patterns": [],
      "sid": null,
      "source": "aws:111122223333:us-east-1/module.app.aws_iam_role.this",
      "target": "aws:111122223333:us-east-1/aws_iam_policy.kms_use",
      "type": "attaches",
      "unevaluated": []
    },
    {
      "actions": [],
      "digest": "a041f52d6a63f17b",
      "effect": null,
      "id": "aws:111122223333:us-east-1/module.app.aws_iam_role.this#attach:module.app.aws_iam_policy.data_read",
      "resolution": "resolved",
      "resource_patterns": [],
      "sid": null,
      "source": "aws:111122223333:us-east-1/module.app.aws_iam_role.this",
      "target": "aws:111122223333:us-east-1/module.app.aws_iam_policy.data_read",
      "type": "attaches",
      "unevaluated": []
    },
    {
      "actions": [
        "sts:AssumeRole"
      ],
      "digest": "dade03efa0966df1",
      "effect": "Allow",